{"analysis_plan_ref":{"anchor":"SS5 (instrument; ONE primary contrast T = pooled mean of WINSORIZED (+-2.0 nats/tok) d_i = NLL(s4-bldf-d) - NLL(s4-semd); FAMILY-CLUSTER seeded bootstrap over the PINNED 30 template families, B=10,000 seed 20260806; VALIDATE-track lb > 0 AND T >= 0.05; KILL-1 upper95 < 0.05 (ASM-2399); TOST +-0.05 on the 90% CI; honest cluster power se ~ 0.025, joint MDE_80 ~ 0.071, SESOI split ~0.05/0.50/0.45; SS5.3 full-verdict power) + SS6 (instrument gates -> INSTRUMENT-INVALID; liveness (incl. the registered 1e-3 stdev floor)/family/pins-present/live-ledger (registered phase-boundary checkpoint sequence) mechanical gates; realized removed-dose matching on the common-token replay within 5% of the dose GATED on per-prompt trajectory-digest identity, projected matching RECOMPUTED from the audit fields; void budget 1; SS6.1 construction-phase pre-spend verdict point + final-phase band/coherence refusals) + SS7 (kill triggers verbatim, tier-scoped dose, pre-spend dose-band stop) + SS10 (skeptic-4 attack record) + SS11 (cross-model pre-run review HOLD -> R2 fix dispositions) + SS12 (skeptic-5 R2 re-attack: 7 findings dispositioned - kill-1 dose floor, io_match power, coherence refusals, corpus-bound rows) + SS13 (stage-4 cross-model RE-REVIEW of R2: 3 residual spurious-verdict paths -> R3 dispositions - trajectory-digest io_match + projected-match recompute, n_target_toks + liveness floor, final-phase dose band/coherence + registered checkpoint sequence + corrected TOST/kill prose)","path":"docs/next/design/glm52-stage4-drop-efficiency.md","sha256":"1d445f07dd55f3a8447f0b9e3f21d3882499a8f50e60f72cca253ef0be312121"},"budget":{"usd_cap":40,"wall_clock_cap_hours":36},"depends_on":[],"design":{"arms_mandatory_baselines":["s4-b0: unmasked pinned-config baseline (quality + throughput + replay reference)","s4-bldf-d: the PRIMARY blind comparator - deployable concept-free frequency heuristic (ascending T-build selection count, EXPERT_BUDGET-analog per colibri #254's heuristic family), greedily matched to s4-semd's projected removed I/O within +-2% (ASM-2387); beating chance validates nothing deployable, so the composite pipeline must beat THIS. EVIDENCE ASYMMETRY IS PART OF THE CLAIM (ASM-2397): the composite consumes ~2 orders of magnitude more routing evidence than this arm's 3,072-token telemetry; the contrast is composite-pipeline-vs-deployable-heuristic, never 'causal vs frequency at matched evidence'.","s4-bldr-d-r1..r3: secondary random blind - seeded cost-proportional draws matched to the same removed I/O (seeds 20260803/20260804/20260805) - separates selection-matters from everything-is-safe-at-this-dose; r2/r3 are the ONLY ladder-droppable arms (disclosed in meta.degradation.dropped_arms; primary completeness is pair-only so drops cannot touch it).","MATCHED-I/O INVARIANT (ASM-2385/2386/2396/2398): every dose-D blind arm matches s4-semd's PROJECTED removed miss-bytes/token within 2% at construction (builder fills a +-1% window; zero-cost cells barred from every fill; identical blind/semd cell sets refused fail-closed) AND the REALIZED removed dose - measured on the COMMON-TOKEN REPLAY of the pinned s4-b0 reference trajectories, (replay-missbytes/tok(s4-b0) - replay-missbytes/tok(arm)) / replay-missbytes/tok(s4-b0) - must match s4-semd's within 5% OF THE DOSE for s4-bldf-d; violation VOIDs (io_match_valid), never reinterpreted; matching is on measured I/O mass, never cell count or nominal cap; free-running decode miss-bytes are descriptive only (divergent generated tokens can no longer contaminate the gated quantity)."],"dependent_vars":[{"better":"n/a","definition":"Quality endpoint carrier: teacher-forced mean NLL per target token on the pinned 300-item suite, ONE prefill per (item x quality arm) - the stage-3-validated final-logit readout (ASM-2390). ALL licensed claims ride the paired PRIMARY contrast d_i = NLL_i(s4-bldf-d) - NLL_i(s4-semd); no correctness/accuracy claim is licensed anywhere in this record.","name":"accuracy","unit":"nats/target-token (mean NLL; lower better)"},{"better":"n/a","definition":"Host parameters UNCHANGED by construction: drop/remap select among native experts; nothing is trained or written.","name":"params","unit":"parameter count (0 added)"},{"better":"lower","definition":"Per-arm mask table files (canonical serialization, whole-file sha256); NO shard-size or page-cache-pool claim attaches.","name":"memory","unit":"mask-table bytes (KB-scale sidecars)"},{"better":"lower","definition":"2,400 quality prefills (300 x 8 arms) + T-build telemetry decode (16x192 tokens) + T-eval decode (4 arms x 2 passes x 8x96 tokens) + COMMON-TOKEN replay (4 arms x 8x96 forced tokens over the pinned s4-b0 reference trajectories). Realized per-arm tok/s (free-running) and replay expert miss-bytes/token are the systems endpoints; tok/s(s4-semd) > tok/s(s4-b0) is a PASS component, its magnitude is descriptive.","name":"inference_compute","unit":"prefills + decode tokens + forced replay tokens + miss-bytes/token"},{"better":"n/a","definition":"Identically ZERO by construction: masks are built offline (CPU, pure function); no gradients anywhere.","name":"training_compute","unit":"FLOPs"}],"independent_vars":[{"levels":["s4-b0","s4-sem16","s4-remap16","s4-semd","s4-bldf-d","s4-bldr-d-r1","s4-bldr-d-r2","s4-bldr-d-r3"],"name":"arm"},{"levels":["quality-suite-300","t-eval-decode","t-eval-replay"],"name":"workload"},{"levels":[1,2,3],"name":"blind_realization"}],"n_planned":{"assumption_ids":"ASM-2384..2396 (designer-15, registry/assumptions.jsonl, 2026-07-16; 2395/2396 skeptic-4 fix wave) + ASM-2397..2400 (designer-18, 2026-07-16, cross-model pre-run review fix wave: estimand option (b), replay/liveness/family/completeness/pins gates, revised kill boundary + full-verdict power, 76-layer universe + construction-phase kill + live ledger) + ASM-2383 (stage-3 scope guard) + ASM-2342 (76 MoE layers, MEASURED) + ASM-2401..2403 (designer-19, 2026-07-16, stage-4 re-review R3 fix wave: trajectory-digest io_match + projected-match recompute; n_target_toks required + liveness meaningful-variance floor; final-phase dose band/coherence refusals + registered phase-boundary checkpoint sequence + corrected TOST/kill prose) - all centrally registered, all resolved except ASM-2389, formally SUPERSEDED by ASM-2399 (re-review item 5c)","budget_note":"usd_cap = 40 AND wall_clock_cap_hours = 36, WHICHEVER BINDS FIRST (inside the bead's 25-40 ceiling; ASM-2393), enforced LIVE (ASM-2400): the runner appends a monotone cost checkpoint at every registered phase boundary and ABORTS (salvage-stop) the moment accrued realized spend reaches a cap; the pinned analysis re-checks the checkpoint trail mechanically against the REGISTERED phase-boundary label sequence (telemetry, masks, bring-up, quality-<arm> x8, t-eval, replay; distinct labels in registered order; absence lawful only for a lawfully dropped ladder arm; duplicate/placeholder trails rejected - ASM-2403). Planning point ~ USD 18 / 16 h on the MEASURED stage-3 basis ~USD 1.15/h, ~11.0 s/prefill (ASM-2392): telemetry 2-8, quality 2,400 prefills 8.4-12.3, throughput 4 arms x 2 passes x 768 decode tokens 4-16 pessimistic, common-token replay 4 arms x 768 forced tokens 1-4, staging ~1.4. Decode s/token UNKNOWN until telemetry (band 2-10 s/tok stipulated); post-telemetry projection over the cap triggers the pre-registered degradation ladder: (1) T-build 192->128 tokens/prompt, (2) T-eval 96->64, (3) drop s4-bldr-d-r2/r3 (ANALYSIS-COMPATIBLE: primary completeness is pair-only, so random-arm drops cannot zero the primary complete cases), (4) STOP and return to the coordinator; the 300-item suite, s4-b0/s4-semd/s4-bldf-d, s4-sem16, and the replay pass are never cut.","coverage_gates_pre_spend":"ALL fail to the coordinator BEFORE quality/throughput spend: telemetry < 2,000 decode tokens; masks fail to re-derive byte-identical; any blind arm outside the 2% projected matching window; bring-up inertness or pin gate failure; post-telemetry cost projection above caps after the full degradation ladder; PRE-SPEND DOSE VERDICT POINT (ASM-2396/2400): the pinned analysis accepts a phase='construction' meta-only stream computed from telemetry+masks alone - an achievable dose capped below 2% FIRES KILL TRIGGER 2 at a ~USD 2-8 ledger, a projected dose in [2%, 8%) is a PRE-SPEND STOP (telemetry + masks return as data; no spend on a verdict fixed in advance), and a projected dose >= 8% REFUSES to emit any verdict (the campaign proceeds).","n_suite_items":"n = 300 pinned suite items EXACTLY (data/glm-s4drop-quality-suite-v1, 10 domains x 3 families x 10; the id->family mapping is PINNED in the analysis, ASM-2398); completeness gate: ZERO missing primary-pair rows (s4-semd, s4-bldf-d) and <= 5 arm-incomplete per secondary arm else VOID; no sampling step","n_tbuild":"16 pinned T-build prompts x 192 new tokens (telemetry only, no quality scoring)","n_teval_prompts":"8 pinned T-eval prompts x 96 new tokens per throughput arm (4 arms) x 2 seeded interleaved passes (free-running) + 1 common-token replay per (arm x prompt) over the pinned s4-b0 reference trajectories (ASM-2398)","power":"Honest CLUSTER power (ASM-2396/2399): planning within-family sigma 0.30 / between-family tau 0.10 (both STIPULATED) => se(T) ~ 0.025 at 30 families x 10 items; joint VALIDATE MDE_80 ~ 0.071 nats/tok. Verdict split under the R2 decision rule (kill = upper95 < SESOI, ASM-2399): at true +0.10 validate ~ 0.977 / kill ~ 1e-4; at the +0.05 SESOI kill ~ 0.05 / validate ~ 0.50 / inconclusive ~ 0.45 (no spurious kill of a true-SESOI effect; the R1 lb<=0 rule killed it at ~0.366 and is RETIRED); at true 0 kill ~ 0.64 / validate ~ 0.02 / inconclusive ~ 0.34. FULL-VERDICT power (ASM-2399, skeptic-5-revised): realized-dose clause P ~ 0.9999 at projected 9.8% (stipulated per-arm transfer sigma_rel 0.05 on the replay currency); io_match 5%-of-dose gate P ~ 0.975 under stipulated between-arm error correlation rho 0.9 (common